<?xml version="1.0" encoding="UTF-8"?>
<ikasleak xmlns:xsi="http://www.w3.org/2001/XMLSchema-instance"
xsi:noNamespaceSchemaLocation="ikasleak06.xsd">
    <ikaslea nan="11111111" errepikatzailea="false" jaiotzaData="2000-01-12">        
        <izena>Iraide Etxeberria</izena>
        <helbidea>
            <kalea>Kale nagusia</kalea>
            <zbk>1000</zbk>
            <herria>Bilbao</herria>
            <probintzia>Bizkaia</probintzia>
        </helbidea>
        <telefonoa>944000000</telefonoa>
        <eposta>iraide@gmail.com</eposta>
    </ikaslea>
    <ikaslea nan="22222222" errepikatzailea="false" jaiotzaData="2000-05-01">
        <izena>Joseba Mikel Zarraga</izena>
        <helbidea>
            <kalea>Gorbeia</kalea>
            <zbk>75</zbk>
            <herria>Artea</herria>
            <probintzia>Bizkaia</probintzia>
        </helbidea>
        <mugikorra>644999999</mugikorra>
        <mugikorra>666777888</mugikorra>
        <eposta>joseba@gmail.com</eposta>
    </ikaslea>
</ikasleak>